Title,Author,Price,Rating
The Brothers Karamazov: A Novel in Four Parts and an Epilogue (Penguin Classics),英語版,"1,998",5つ星のうち4.6
The Brothers Karamazov (English Edition),英語版,345,5つ星のうち4.4
The Karamazov Brothers (Wordsworth Classics),英語版,664,5つ星のうち4.7
The Brothers Karamazov: A Novel in Four Parts With Epilogue (English Edition),英語版,"1,500",5つ星のうち4.7
The Brothers Karamazov,英語版,"1,110",5つ星のうち4.5
The Brothers Karamazov (English Edition),英語版,348,5つ星のうち4.6
The Brothers Karamazov (English Edition),英語版,"1,557",5つ星のうち4.5
The Brothers Karamazov (English Edition),英語版,531,5つ星のうち4.4
The Brothers Karamazov: A New Translation by Michael R. Katz (English Edition),英語版,"3,411",5つ星のうち4.7
The Brothers Karamazov (Translated by Constance Garnett) (English Edition),英語版,989,5つ星のうち4.5
The Brothers Karamazov (Centaur Classics) [The 100 greatest novels of all time - #8] (English Edition),英語版,275,5つ星のうち4.4
The Brothers Karamazov,英語版,"3,845",
The Brothers Karamazov (Xist Classics) (English Edition),英語版,174,5つ星のうち4.4
The Brothers Karamazov (English Edition),英語版,"1,051",5つ星のうち5.0
The Brothers Karamazov (English Edition),英語版,350,5つ星のうち4.4
The Brothers Karamazov (English Edition),英語版,97,5つ星のうち5.0
The Brothers Karamazov: The 1880 Russian Literary Classic (Annotated) (English Edition),英語版,420,
The Brothers Karamazov: Revised and Abridged Thomas Beyer (English Edition),英語版,0,
The Brothers Karamazov: By Fyodor Dostoyevsky - Illustrated (English Edition),英語版,109,5つ星のうち4.6
The Brothers Karamazov (English Edition),英語版,155,
The Brothers Karamazov (Annotated): Original Faithful Translation World Literature Book Clubs Must Read Literary Book,英語版,"2,930",5つ星のうち5.0
The Brothers Karamazov,英語版,"4,241",
"The brothers Karamazov: illustrated, BIBLIOTHECA CLASSICA",英語版,"2,769",
カラマーゾフの兄弟 The Brothers Karamazov (ラダーシリーズ Level 4),,"1,100",5つ星のうち4.4
The Brothers Karamazov: BIBLIOTHECA CLASSICA,英語版,"2,769",
The Brothers Karamazov (English Edition),英語版,708,
The Brothers Karamazov,英語版,"3,875",
The Brothers Karamazov (English Edition),英語版,312,5つ星のうち2.0
Братья Карамазов (Brat'ya Karamazovy. The Brothers Karamazov) (Russian Edition),ロシア語版,627,5つ星のうち5.0
The Brothers Karamazov (English Edition),英語版,755,
The Brothers Karamazov (Bicentennial Edition) (English Edition),英語版,568,5つ星のうち4.7
The Brothers Karamazov: Philosophical Literary Fiction (Annotated) (English Edition),英語版,"1,207",
The Brothers Karamazov,英語版,,
The Brothers Karamazov: Classical Russian Literature (Annotated) (English Edition),英語版,500,5つ星のうち5.0
The Brothers Karamazov (Easy Classics) (The Easy Classics Epic Collection) (English Edition),14,0,5つ星のうち4.6
The Brothers Karamazov,英語版,"2,946",
The Brothers Karamazov,英語版,"3,186",
The Brothers Karamazov: Fyodor Mikhailovich Dostoyevsky (English Edition),英語版,419,5つ星のうち4.5
The Brothers Karamazov: Epic Russian literary classic involving rivalry and murder,英語版,"2,952",
The Brothers Karamazov: Illustrated edition in English and Spanish (English Edition),英語版,0,
The Brothers Karamazov (Collector's Library),英語版,"9,154",5つ星のうち4.4
The Brothers Karamazov,英語版,"3,639",
The Brothers Karamazov (English Edition),英語版,948,
The Brothers Karamazov,英語版,"2,393",
"The Brothers Karamazov: A Saga of Faith, Reason, and Desperation (Annotated)",英語版,"3,110",
"The Complete Works of Fyodor Dostoyevsky: Novels, Short Stories and Autobiographical Writings: The Entire Opus of the Great Russian Novelist, Journalist ... The Brothers Karamazov… (English Edition)",英語版,109,5つ星のうち4.2
The Brothers Karamazov: Vol.2,英語版,"1,546",
The Brothers Karamazov,英語版,"4,219",
